<?xml version="1.0" encoding="UTF-8"?>
<companyInfo xmlns:xsi='http://www.w3.org/2001/XMLSchema-instance' 
             xmlns='http://www.mc-boden.se/id2208/schema'
             xsi:schemaLocation='http://www.mc-boden.se/id2208/schema http://www.mc-boden.se/id2208/schema/CompanyInfo.xsd'>    
    <company>
        <name>Microsoft</name>
        <orgNo>123456-7800</orgNo>
        <phoneNumber>08-11122</phoneNumber>
    </company>
    <company>
        <name>Google</name>
        <orgNo>123456-7801</orgNo>>
        <phoneNumber>08-22233</phoneNumber>
    </company>
    <company>
        <name>Twitter</name>
        <orgNo>123456-7802</orgNo>
        <phoneNumber>08-33344</phoneNumber>
    </company>
</companyInfo>
